{
  "eventId": "3f2a1b0c-9d8e-3f7a-8b6c-5d4e3f2a1b0c",
  "occurredAt": "2026-10-26T12:05:00Z",
  "customerId": "f3b1c2d4-5e6f-4a7b-8c9d-0e1f2a3b4c5d",
  "version": 1792929600000,
  "change": "ABANDONED",
  "cart": {
    "items": [
      { "variantId": "AUD-JBL-FLIP-6", "quantity": 1 },
      { "variantId": "PHN-PIXEL-9", "quantity": 2 }
    ],
    "lastChangedAt": "2026-10-25T12:00:00Z"
  }
}
